{
 "id": "kena_vakya_shankara",
 "text": "Kena Upaniṣad Vākyabhāṣya",
 "tradition": "Advaita",
 "commentator": "Śaṃkara",
 "script": "Devanagari",
 "units": [
  {
   "ref": "intro-1",
   "kind": "prose",
   "scope": "commentary",
   "sanskrit": "समाप्तं कर्मात्मभूतप्राणविषयं विज्ञानं कर्म चानेकप्रकारम् , ययोर्विकल्पसमुच्चयानुष्ठानाद्दक्षिणोत्तराभ्यां सृतिभ्यामावृत्त्यनावृत्ती भवतः । अत ऊर्ध्वं फलनिरपेक्षज्ञानकर्मसमुच्चयानुष्ठानात्कृतात्मसंस्कारस्य उच्छिन्नात्मज्ञानप्रतिबन्धकस्य द्वैतविषयदोषदर्शिनः निर्ज्ञाताशेषबाह्यविषयत्वात् संसारबीजमज्ञानमुच्चिच्छित्सतः प्रत्यगात्मविषयजिज्ञासोः ‘केनेषितम् . . . ’ इत्यात्मस्वरूपतत्त्वविज्ञानाय अयमध्याय आरभ्यते । तेन च मृत्युपदमज्ञानमुच्छेत्तव्यम् ; तत्तन्त्रो हि संसारो यतः । अनधिगतत्वादात्मनो युक्ता तदधिगमाय तद्विषया जिज्ञासा । कर्मविषये चानुक्तिस्तद्विरोधित्वात् । अस्य विजिज्ञासितव्यस्यात्मतत्त्वस्य कर्मविषयेऽवचनं कस्मादिति चेत् , आत्मनो हि यथावद्विज्ञानं कर्मणा विरुध्यते । निरतिशयब्रह्मस्वरूपो ह्यात्मा विजिज्ञापयिषितः, ‘तदेव ब्रह्म त्वं विद्धि नेदं यदिदम्’(के. उ. १ । ४) इत्यादिश्रुतेः । न हि स्वाराज्येऽभिषिक्तो ब्रह्मत्वं गमितः कञ्चन नमितुमिच्छति । अतो ब्रह्मास्मीति सम्बुद्धौ न कर्म कारयितुं शक्यते । न ह्यात्मानमवाप्तार्थं ब्रह्म मन्यमानः प्रवृत्तिं प्रयोजनवतीं पश्यति । न च निष्प्रयोजना प्रवृत्तिः । अतो विरुध्यत एव कर्मणा ज्ञानम् । अतः कर्मविषयेऽनुक्तिः । विज्ञानविशेषविषयैव जिज्ञासा । कर्मानारम्भ इति चेत् , न ; निष्कामस्य संस्कारार्थत्वात् । यदि ह्यात्मविज्ञानेन आत्माविद्याविषयत्वात्परितित्याजयिषितं कर्म, ततः ‘प्रक्षालनाद्धि पङ्कस्य दूरादस्पर्शनं वरम्’(?) इत्यनारम्भ एव कर्मणः श्रेयान् अल्पफलत्वात् आयासबहुलत्वात् तत्त्वज्ञानादेवं च श्रेयःप्राप्तेः इति चेत् , सत्यम् एतदविद्याविषयं कर्म अल्पफलत्वादिदोषवद्बन्धरूपं च सकामस्य ; ‘कामान्यः कामयते’(मु. उ. ३ । २ । २) ‘इति नु कामयमानः’(बृ. उ. ४ । ४ । ६) इत्यादिश्रुतिभ्यः । न निष्कामस्य । तस्य तु संस्कारार्थान्येव कर्माणि भवन्ति तन्निर्वर्तकप्राणविज्ञानसहितानि । ‘देवयाजी श्रेयानात्मयाजी वा’इत्युपक्रम्य ‘आत्मयाजी तु करोतीदं मेऽनेनाङ्गं संस्क्रियते’ इति संस्कारार्थमेव कर्माणीति वाजसनेयके ; ‘महायज्ञैश्च यज्ञैश्च ब्राह्मीयं क्रियते तनुः । ’(मनु. २ । २८) ‘यज्ञो दानं तपश्चैव पावनानि मनीषिणाम्’(भ. गी. १८ । ५) इत्यादिस्मृतेश्च । प्राणादिविज्ञानं च केवलं कर्मसमुच्चितं वा सकामस्य प्राणात्मप्राप्त्यर्थमेव भवति । निष्कामस्य त्वात्मज्ञानप्रतिबन्धकनिर्मृष्ट्यै भवत्यादर्शनिर्मार्जनवत् । उत्पन्नात्मविद्यस्य त्वनारम्भः, निरर्थकत्वात् । ‘कर्मणा बध्यते जन्तुर्विद्यया च विमुच्यते । तस्मात्कर्म न कुर्वन्ति यतयः पारदर्शिनः’(मो. ध. २४१_७) इति, क्रियापथश्चैव पुरस्तात्संन्यासश्च तयोः संन्यास एवात्यरेचयत् इति, ‘त्यागेनैके’(तै. ना. २८) ‘नान्यः पन्था विद्यते’(श्वे. उ. ३ । ८) इत्यादिश्रुतिभ्यश्च । न्यायाच्च । उपायभूतानि हि कर्माणि संस्कारद्वारेण ज्ञानस्य । ज्ञानेन त्वमृतत्वप्राप्तिः, ‘अमृतत्वं हि विन्दते’(के. उ. २ । ४) ‘विद्यया विन्दतेऽमृतम्’(के. उ. २ । ४) इत्यादिश्रुतिस्मृतिभ्यश्च । न हि नद्याः पारगो नावं न मुञ्चति यथेष्टदेशगमनं प्रति स्वातन्त्र्ये सति । न हि स्वभावसिद्धं वस्तु सिषाधयिषति साधनैः । स्वभावसिद्धश्चात्मा । तथा नापिपयिषितः, आत्मत्वे सति नित्याप्तत्वात् । नापि विचिकारयिषितः, आत्मत्वे सति नित्यत्वादविकारित्वादविषयत्वादमूर्तत्वाच्च ; श्रुतेश्च ‘न वर्धते कर्मणा’(बृ. उ. ४ । ४ । २३) इत्यादि ; स्मृतेश्च ‘अविकार्योऽयमुच्यते’(भ. गी. २ । २५) इति । न च सञ्चिस्कीर्षितः, ‘शुद्धमपापविद्धम्’(ई. उ. ८) इत्यादिश्रुतिभ्यः । अनन्यत्वाच्च । अन्येनान्यत्संस्क्रियते । न चात्मनोऽन्यभूता क्रियास्ति । न च स्वेनैवात्मना स्वमात्मानं सञ्चिस्कीर्षेत् । न च वस्त्वन्तराधानं नित्यप्राप्तिर्वा वस्त्वन्तरस्य नित्या । नित्यत्वं चेष्टं मोक्षस्य । अत उत्पन्नविद्यस्य कर्मारम्भोऽनुपपन्नः । अतो व्यावृत्तबाह्यबुद्धेरात्मविज्ञानाय ‘केनेषितम्’ इत्याद्यारम्भः ॥",
   "english": null
  },
  {
   "ref": "1.1",
   "kind": "verse",
   "scope": "mula+commentary",
   "sanskrit": "केनेषितं पतति प्रेषितं मनः केन प्राणः प्रथमः प्रैति युक्तः ।\nकेनेषितां वाचमिमां वदन्ति चक्षुःश्रोत्रं क उ देवो युनक्ति ॥ १ ॥\nप्रवृत्तिलिङ्गाद्विशेषार्थः प्रश्न उपपन्नः । रथादीनां हि चेतनावदधिष्ठितानां प्रवृत्तिर्दृष्टा, न अनधिष्ठितानाम् । मनआदीनां च अचेतनानां प्रवृत्तिर्दृश्यते ; तद्धि लिङ्गं चेतनावतोऽधिष्ठातुरस्तित्वे । करणानि हि मनआदीनि नियमेन प्रवर्तन्ते ; तन्नासति चेतनावत्यधिष्ठातर्युपपद्यते । तद्विशेषस्य चानधिगमाच्चेतनावत्यधिष्ठातृसामान्ये चाधिगते विशेषार्थः प्रश्न उपपद्यते । केनेषितं केनेष्टं कस्येच्छामात्रेण मनः पतति गच्छति, स्वविषये नियमेन व्याप्रियत इत्यर्थः । मनुतेऽनेनेति विज्ञाननिमित्तमन्तःकरणं मनः । प्रेषितमिवेत्युपमार्थः । न त्विषितप्रेषितशब्दयोरर्थाविह सम्भवतः । न हि शिष्यानिव मनआदीनि विषयेभ्यः प्रेषयत्यात्मा । विविक्तनित्यचित्स्वरूपतया तु निमित्तमात्रं प्रवृत्तौ नित्यचिकित्साधिष्ठातृवत् । प्राण इति नासिकाभवः प्रकरणात् । प्रथमत्वं चलन क्रियायाः प्राणनिमित्तत्वात् । स्वतो विषयावभासमात्रं करणानां प्रवृत्तिः । चलिक्रिया तु प्राणस्यैव मनआदिषु । तस्मात्प्राथम्यं प्राणस्य । प्रैति गच्छति । युक्तः प्रयुक्त इत्येतत् । वाचो वचनं किंनिमित्तं प्राणिनाम् । चक्षुःश्रोत्रयोश्च को देवः प्रयोक्ता । करणानामधिष्ठाता चेतनावान्यः, स किंविशेषण इत्यर्थः ॥",
   "english": null,
   "parts": [
    {
     "role": "mula",
     "sanskrit": "केनेषितं पतति प्रेषितं मनः केन प्राणः प्रथमः प्रैति युक्तः ।\nकेनेषितां वाचमिमां वदन्ति चक्षुःश्रोत्रं क उ देवो युनक्ति ॥ १ ॥"
    },
    {
     "role": "bhashya",
     "sanskrit": "प्रवृत्तिलिङ्गाद्विशेषार्थः प्रश्न उपपन्नः । रथादीनां हि चेतनावदधिष्ठितानां प्रवृत्तिर्दृष्टा, न अनधिष्ठितानाम् । मनआदीनां च अचेतनानां प्रवृत्तिर्दृश्यते ; तद्धि लिङ्गं चेतनावतोऽधिष्ठातुरस्तित्वे । करणानि हि मनआदीनि नियमेन प्रवर्तन्ते ; तन्नासति चेतनावत्यधिष्ठातर्युपपद्यते । तद्विशेषस्य चानधिगमाच्चेतनावत्यधिष्ठातृसामान्ये चाधिगते विशेषार्थः प्रश्न उपपद्यते । केनेषितं केनेष्टं कस्येच्छामात्रेण मनः पतति गच्छति, स्वविषये नियमेन व्याप्रियत इत्यर्थः । मनुतेऽनेनेति विज्ञाननिमित्तमन्तःकरणं मनः । प्रेषितमिवेत्युपमार्थः । न त्विषितप्रेषितशब्दयोरर्थाविह सम्भवतः । न हि शिष्यानिव मनआदीनि विषयेभ्यः प्रेषयत्यात्मा । विविक्तनित्यचित्स्वरूपतया तु निमित्तमात्रं प्रवृत्तौ नित्यचिकित्साधिष्ठातृवत् । प्राण इति नासिकाभवः प्रकरणात् । प्रथमत्वं चलन क्रियायाः प्राणनिमित्तत्वात् । स्वतो विषयावभासमात्रं करणानां प्रवृत्तिः । चलिक्रिया तु प्राणस्यैव मनआदिषु । तस्मात्प्राथम्यं प्राणस्य । प्रैति गच्छति । युक्तः प्रयुक्त इत्येतत् । वाचो वचनं किंनिमित्तं प्राणिनाम् । चक्षुःश्रोत्रयोश्च को देवः प्रयोक्ता । करणानामधिष्ठाता चेतनावान्यः, स किंविशेषण इत्यर्थः ॥"
    }
   ]
  },
  {
   "ref": "1.2",
   "kind": "verse",
   "scope": "mula+commentary",
   "sanskrit": "श्रोत्रस्य श्रोत्रं मनसो मनो यद्वाचो ह वाचं स उ प्राणस्य प्राणः ।\nचक्षुषश्चक्षुरतिमुच्य धीराः प्रेत्यास्माल्लोकादमृता भवन्ति ॥ २ ॥\n‘श्रोत्रस्य श्रोत्रम्’ इत्यादिप्रतिवचनं निर्विशेषस्य निमित्तत्वार्थम् । विक्रियादिविशेषरहितस्यात्मनो मनआदिप्रवृत्तौ निमित्तत्वमित्येतत् ‘श्रोत्रस्य श्रोत्रम्’ इत्यादिप्रतिवचनस्यार्थः, अनुगमात् । अनुगतानि ह्यस्मिन्नर्थेऽक्षराणि । कथम् ? शृणोत्यनेनेति श्रोत्रम् । तस्य शब्दावभासकत्वं श्रोत्रत्वम् । शब्दोपलब्धृरूपतयावभासकत्वं न स्वतः श्रोत्रस्य ; अचिद्रूपत्वात् , आत्मनश्च चिद्रूपत्वात् । यच्छ्रोत्रस्योपलब्धृत्वेनावभासकत्वं तदात्मनिमित्तत्वाच्छ्रोत्रस्य श्रोत्रमित्युच्यते । यथा क्षत्रस्य क्षत्रम् , यथा वा उदकस्यौष्ण्यमग्निनिमित्तमिति दग्धुरप्युदकस्य दग्धाग्निरुच्यते उदकमपि ह्यग्निसंयोगादग्निरुच्यते, तद्वदनित्यं यत्संयोगादुपलब्धृत्वं तत्करणं श्रोत्रादि । उदकस्येव दग्धृत्वमनित्यं हि तत्र तत् । यत्र तु नित्यमुपलब्धृत्वमग्नाविवौष्ण्यं स नित्योपलब्धिस्वरूपत्वात् दग्धेवोपलब्धोच्यते । श्रोत्रादिषु श्रोतृत्वाद्युपलब्धिरनित्या, नित्या चात्मनि । अतः श्रोत्रस्य श्रोत्रमित्याद्यक्षराणामर्थानुगमादुपपद्यते निर्विशेषस्योपलब्धिस्वरूपस्यात्मनो मनआदिप्रवृत्तिनिमित्तत्वमिति । मनआदिष्वेवं यथोक्तम् । वाचो ह वाचं प्राणस्य प्राण इति विभक्तिद्वयम् । सर्वत्रैवं हि द्रष्टव्यम् । कथम् ? पृष्टत्वात् स्वरूपनिर्देशः । प्रथमयैव च निर्देशः । तस्य च ज्ञेयत्वात्कर्मत्वमिति द्वितीया । अतो वाचो ह वाचं प्राणस्य प्राण इत्यस्मात्सर्वत्रैव विभक्तिद्वयम् । यदेतच्छ्रोत्राद्युपलब्धिनिमित्तं श्रोत्रस्य श्रोत्रमित्यादिलक्षणं तत् नित्योपलब्धिस्वरूपं निर्विशेषमात्मतत्त्वं बुद्ध्वा अतिमुच्य अनवबोधनिमित्ताध्यारोपिताद्बुद्ध्यादिलक्षणात्संसारान्मोक्षणं कृत्वा धीराः धीमन्तः प्रेत्य अस्मात् लोकात् शरीरात् प्रेत्य वियुज्य अन्यस्मिन्नप्रतिसन्धीयमाने निर्निमित्तत्वादमृता भवन्ति । सति ह्यज्ञाने कर्माणि शरीरान्तरं प्रतिसन्दधते । आत्मावबोधे तु सर्वकर्मारम्भनिमित्ताज्ञानविपरीतविद्याग्निविप्लुष्टत्वात्कर्मणामिति अनारम्भेऽमृता एव भवन्ति । शरीरादिसन्तानाविच्छेदप्रतिसन्धानाद्यपेक्षया अध्यारोपितमृत्युवियोगात्पूर्वमप्यमृताः सन्तो नित्यात्मस्वरूपत्वादमृता भवन्तीत्युपचर्यते ॥",
   "english": null,
   "parts": [
    {
     "role": "mula",
     "sanskrit": "श्रोत्रस्य श्रोत्रं मनसो मनो यद्वाचो ह वाचं स उ प्राणस्य प्राणः ।\nचक्षुषश्चक्षुरतिमुच्य धीराः प्रेत्यास्माल्लोकादमृता भवन्ति ॥ २ ॥"
    },
    {
     "role": "bhashya",